id,date,raw_text,player_name,clubs_mentioned,player_age,player_nationality,player_position,time_to_transfer_window,source,market_value
2866,18 July 2021,Fenerbahce are in talks with West Ham United over a £2m deal for the Hammers' 31-year-old Ukraine winger Andriy Yarmolenko.,Andriy Yarmolenko,"['Fenerbahce', 'West Ham United']",34,Ukraine,Right Winger,44,www.footballinsider247.com,€2.50m
2868,18 July 2021,"Brazil left-back Alex Telles has played down talk that he could leave Manchester United this summer by saying it is ""a pleasure to be at"" Old Trafford. The 28-year-old, who joined United from Porto last year, has been linked with Roma and Inter Milan.",Alex Telles,"['Manchester United', 'Porto', 'Roma', 'Inter Milan']",,,,44,www.goal.com,
2873,18 July 2021,"Crystal Palace are set to beat Leeds United in the race to sign Peterborough United's Portuguese forward Adler Nascimento, 16, who also previously attracted interest from Wolves and Brighton.",Adler Nascimento,"['Crystal Palace', 'Leeds United', 'Wolves', 'Brighton']",,,,44,www.dailymail.co.uk,
2874,18 July 2021,Bournemouth's Asmir Begovic has passed a medical before the 34-year-old Bosnia keeper's proposed move to Everton.,Asmir Begovic,"['Bournemouth', 'Everton']",36,Bosnia and Herzegovina,Goalkeeper,44,talksport.com,€1.00m
2875,18 July 2021,"Brexit could help Manchester United land 30-year-old Atletico Madrid and England right-back Kieran Tripper, as La Liga regulations surrounding British players have recently expired.",Kieran Tripper,"['Manchester United', 'Atletico Madrid']",33,England,Right-Back,44,www.express.co.uk,€13.00m
2876,18 July 2021,"While Brexit might boost United's transfer hopes, Gareth Bale, 32, faces an uncertain future after his loan spell at Tottenham Hotspur ended, as Real Madrid are only permitted to have three non-European Union players in their squad in line with La Liga regulations.",Gareth Bale,"['Tottenham Hotspur', 'Real Madrid']",,,,44,www.mirror.co.uk,
2877,18 July 2021,"Were Trippier to join United, Atletico Madrid will move for Norwich and England Under-21 full-back Max Aarons, who may cost the Spanish champions about £25m.",Trippier,"['United', 'Atletico Madrid', 'Norwich']",33,England,Right-Back,44,www.mirror.co.uk,€13.00m
2877,18 July 2021,"Were Trippier to join United, Atletico Madrid will move for Norwich and England Under-21 full-back Max Aarons, who may cost the Spanish champions about £25m.",Max Aarons,"['Atletico Madrid', 'Norwich']",23,England,,44,www.mirror.co.uk,
2881,19 July 2021,"Chelsea are ""leaving no stone unturned"" in their pursuit of Borussia Dortmund striker Erling Braut Haaland, 20, although the chances of a swap deal for the Norwegian are said to be low.",Erling Braut Haaland,"['Chelsea', 'Borussia Dortmund']",,,,43,sport.sky.de,
2882,19 July 2021,"The Blues have also offered England winger Callum Hudson-Odoi, 20, to Bayern Munich in a swap deal for the German club's 25-year-old French winger Kingsley Coman.",Callum Hudson-Odoi,"['Chelsea', 'Bayern Munich']",23,England,Left Winger,43,www.lequipe.fr,€17.00m
2884,19 July 2021,"Everton are closing in on a deal to sign English winger Andros Townsend, 30, who is a free agent after leaving Crystal Palace and would become Rafael Benitez's first signing as Toffees boss. The club are also pursuing Bayer Leverkusen's English winger Demarai Gray, 25.",Andros Townsend,"['Everton', 'Crystal Palace', 'Bayer Leverkusen']",32,England,Right Winger,43,www.mirror.co.uk,€2.50m
2885,19 July 2021,"Everton are also one of two clubs, along with Premier League rivals West Ham, to have approached Barcelona over a deal for 26-year-old French defender Clement Lenglet.",Clement Lenglet,"['Everton', 'West Ham', 'Barcelona']",28,France,Centre-Back,43,as.com,€12.00m
2886,19 July 2021,"Juventus will have to pay £43m in order to land Brazilian striker Gabriel Jesus from Manchester City. The Serie A side have identified the 24-year-old, who has two years left on his City contract, as one of their top targets.",Gabriel Jesus,"['Juventus', 'Manchester City']",,,,43,www.calciomercato.com,
2889,19 July 2021,"Barca may also freeze Philippe Coutinho out of first-team action if they fail to offload the Brazilian playmaker, 29, this summer. Coutinho is 10 games away from activating a clause which would see the La Liga club pay Liverpool an extra £17.1m, having signed him from the Premier League side in January 2018.",Philippe Coutinho,"['Barcelona', 'Liverpool']",31,Brazil,Left Winger,43,as.com,€14.00m
2890,19 July 2021,"Brighton will see if a deal can be done for Celtic's 23-year-old French forward Odsonne Edouard, who is in the final year of his contract.",Odsonne Edouard,"['Brighton', 'Celtic']",25,France,Centre-Forward,43,www.express.co.uk,€17.00m
2892,19 July 2021,"Cristiano Ronaldo posted ""decision day"" on Instagram the day after L'Equipe reported that the transfer of Argentina striker Mauro Icardi, 28, from Paris St-Germain to Juventus depends on whether the Portugal forward, 36, leaves Juve.",Cristiano Ronaldo,"['Juventus', 'Paris St-Germain']",38,Portugal,Centre-Forward,43,as.com,€20.00m
2893,19 July 2021,"Manchester United are the main interested party regarding Kieran Trippier but Atletico Madrid are keen to keep hold of the England right-back, 30.",Kieran Trippier,"['Manchester United', 'Atletico Madrid']",33,England,Right-Back,43,as.com,€13.00m
2894,19 July 2021,"Manchester United manager Ole Gunnar Solskjaer says 28-year-old English attacking midfielder Jesse Lingard, who impressed during a spell on loan at West Ham last season, is in his plans ""at the moment"".",Jesse Lingard,"['Manchester United', 'West Ham']",31,England,Attacking Midfield,43,www.manchestereveningnews.co.uk,€12.00m
2899,19 July 2021,"French winger Thomas Robert, son of former Newcastle winger Laurent Robert, is training with Burnley as the 20-year-old hopes to join their Under-23s squad.",Thomas Robert,"['Burnley', 'Newcastle']",24,Wales,,43,www.thesun.co.uk,
2900,19 July 2021,Burnley are set to sign Wales keeper Wayne Hennessey on a free transfer after the 34-year-old left Crystal Palace following the end of his contract.,Wayne Hennessey,"['Burnley', 'Crystal Palace']",36,Wales,Goalkeeper,43,www.dailymail.co.uk,€500k
2901,19 July 2021,"Newcastle United have agreed to sell French defender Florian Lejeune to Alaves, with the 30-year-old having spent last season on loan at the Spanish club.",Florian Lejeune,"['Newcastle United', 'Alaves']",,,,43,www.chroniclelive.co.uk,
2903,20 July 2021,"Chelsea know West Ham United and England midfielder Declan Rice, 22, is keen to join them and they will approach the Hammers to find out what it would take for a deal to be done.",Declan Rice,"['Chelsea', 'West Ham United']",24,England,,42,www.express.co.uk,
2904,20 July 2021,"Meanwhile, Chelsea's England winger Callum Hudson-Odoi, 20, is staying to fight for his place - ending hopes of him moving to Bayern Munich as part of a swap deal for France winger Kingsley Coman, 25.",Callum Hudson-Odoi,"['Chelsea', 'Bayern Munich']",23,England,Left Winger,42,www.thesun.co.uk,€17.00m
2906,20 July 2021,"Atletico Madrid are adamant England full-back Kieran Trippier, 30, is not for sale amid interest from Manchester United - but the Spanish club would replace him with Wolves and Portugal right-back Nelson Semedo, 27, or Napoli and Italy right-back Giovanni di Lorenzo, 27, if he does leave.",Kieran Trippier,"['Atletico Madrid', 'Manchester United', 'Wolverhampton Wanderers']",33,England,Right-Back,42,en.as.com,€13.00m
2906,20 July 2021,"Atletico Madrid are adamant England full-back Kieran Trippier, 30, is not for sale amid interest from Manchester United - but the Spanish club would replace him with Wolves and Portugal right-back Nelson Semedo, 27, or Napoli and Italy right-back Giovanni di Lorenzo, 27, if he does leave.",Nelson Semedo,"['Atletico Madrid', 'Wolverhampton Wanderers', 'Napoli']",,,,42,en.as.com,
2907,20 July 2021,"Tottenham Hotspur are in advanced talks over a deal for Atalanta's Argentina centre-back Cristian Romero, 23.",Cristian Romero,"['Tottenham Hotspur', 'Atalanta']",25,Argentina,Centre-Back,42,www.football.london,€60.00m
2910,20 July 2021,"Real Madrid and France centre-back Raphael Varane, 28, is open to a move to the Premier League and Manchester United are confident personal terms will not be a problem.",Raphael Varane,"['Real Madrid', 'Manchester United']",30,France,Centre-Back,42,www.theguardian.com,€40.00m
2912,20 July 2021,"Alternatively, Napoli owner Aurelio de Laurentiis has rejected a £30m bid from Manchester United for Senegal defender Kalidou Koulibaly, 30.",Kalidou Koulibaly,"['Manchester United', 'Napoli']",,,,42,www.gazzetta.it,
2914,20 July 2021,"United's France midfielder Paul Pogba, 28, Juventus and Portugal forward Cristiano Ronaldo, 36, and Paris St-Germain's France forward Kylian Mbappe, 22, are among the players who could move on free transfers next summer as a result of the financial impact on clubs caused by the coronavirus pandemic.",Paul Pogba,"['United', 'Juventus']",30,France,Central Midfield,42,www.espn.com,€20.00m
2914,20 July 2021,"United's France midfielder Paul Pogba, 28, Juventus and Portugal forward Cristiano Ronaldo, 36, and Paris St-Germain's France forward Kylian Mbappe, 22, are among the players who could move on free transfers next summer as a result of the financial impact on clubs caused by the coronavirus pandemic.",Cristiano Ronaldo,"['Juventus', 'Paris St-Germain']",38,Portugal,Centre-Forward,42,www.espn.com,€20.00m
2915,20 July 2021,"Bournemouth's Netherlands forward Arnaut Danjuma, 24, is wanted by Spanish club Villarreal. Danjuma scored 15 times in 33 Championship games in 2020-21.",Arnaut Danjuma,"['Bournemouth', 'Villarreal']",26,Netherlands,Left Winger,42,www.thesun.co.uk,€27.00m
2916,20 July 2021,"Southampton and England striker Danny Ings, 28, has his mind set on a move to Manchester City or Manchester United, but the south coast club are yet to receive an enquiry for him.",Danny Ings,"['Southampton', 'Manchester City', 'Manchester United']",31,England,Centre-Forward,42,talksport.com,€16.00m
2917,20 July 2021,"Everton are interested in Burnley winger Dwight McNeil, 21, in a deal worth £25m, but face competition from Aston Villa.",Dwight McNeil,"['Everton', 'Burnley', 'Aston Villa']",24,England,Left Winger,42,www.liverpoolecho.co.uk,€18.00m
2918,20 July 2021,"Burnley have shown interest in Lyon's Ivory Coast left-back Maxwel Cornet, 24.",Maxwel Cornet,"['Burnley', 'Lyon']",27,Côte d'Ivoire,Left Winger,42,www.lequipe.fr,€15.00m
2919,20 July 2021,"Brighton & Hove Albion are lining up a £15m move for Liverpool centre-back Nathaniel Phillips, 24, to replace Arsenal-bound Ben White.",Nathaniel Phillips,"['Brighton & Hove Albion', 'Liverpool']",28,England,Centre-Back,42,talksport.com,€6.00m
2921,20 July 2021,"Southampton, Leeds United and West Ham have all shown interest in signing Manchester City's £20m-rated Venezuela midfielder Yangel Herrera, 23.",Yangel Herrera,"['Southampton', 'Leeds United', 'West Ham']",,,,42,www.thesun.co.uk,
2922,20 July 2021,"Liverpool's Nigeria Under-23 forward Taiwo Awoniyi, 23, is having a medical at Union Berlin after the two clubs agreed a £6.5m fee. Serbia midfielder Marko Grujic, 25, is finalising a £10.5m move to Porto.",Taiwo Awoniyi,"['Liverpool', 'Union Berlin']",26,Nigeria,Centre-Forward,42,twitter.com,€20.00m
2922,20 July 2021,"Liverpool's Nigeria Under-23 forward Taiwo Awoniyi, 23, is having a medical at Union Berlin after the two clubs agreed a £6.5m fee. Serbia midfielder Marko Grujic, 25, is finalising a £10.5m move to Porto.",Marko Grujic,"['Serbia', 'Porto']",,,,42,twitter.com,
2923,20 July 2021,"Barcelona have been offered the opportunity to sign Manchester United and Netherlands midfielder Donny van de Beek, 24, with the Spanish club offering France defender Samuel Umtiti, 27, as part of a swap deal.",Donny van de Beek,"['Manchester United', 'Barcelona']",26,Netherlands,Central Midfield,42,www.express.co.uk,€17.00m
2924,20 July 2021,"Leeds are considering a move for Wolverhampton Wanderers' Spain winger Adama Traore, 25.",Adama Traore,"['Leeds', 'Wolverhampton Wanderers']",,,,42,www.90min.com,
2925,20 July 2021,"Chelsea youngster Lewis Bates is attracting interest from Liverpool, West Ham, Leeds and Southampton, with the England Under-19 midfielder having just one year left on his contract.",Lewis Bates,"['Liverpool', 'West Ham', 'Leeds', 'Southampton']",21,England,,42,www.dailymail.co.uk,
2926,20 July 2021,"Fulham are the most likely to sign Liverpool and Wales winger Harry Wilson, with the 24-year-old accepting he needs to move on a permanent basis for his career.",Harry Wilson,"['Fulham', 'Liverpool']",26,Wales,Right Winger,42,www.goal.com,€13.00m
2927,20 July 2021,"Bournemouth are favourites to sign Scott Dann, 34, on a free transfer after the defender left Crystal Palace.",Scott Dann,"['Bournemouth', 'Crystal Palace']",,,,42,www.footballinsider247.com,
2929,22 July 2021,"Manchester United and France midfielder Paul Pogba, 28, is a target for Paris St-Germain this summer and the Ligue 1 side are seeking to sell players to raise the £50m they believe will secure a deal.",Paul Pogba,"['Manchester United', 'Paris St-Germain']",30,France,Central Midfield,40,www.mirror.co.uk,€20.00m
2931,22 July 2021,"Real Madrid's France centre-back Raphael Varane, 28, is keen for a move to Manchester United to be completed within the next few days.",Raphael Varane,"['Real Madrid', 'Manchester United']",30,France,Centre-Back,40,as.com,€40.00m
2935,22 July 2021,"Meanwhile, the Gunners are willing to offer Leicester City a number of players - including 21-year-old English winger Reiss Nelson - as part of a deal to sign England midfielder James Maddison, 24.",Reiss Nelson,"['Arsenal', 'Leicester City']",24,England,Right Winger,40,www.dailymail.co.uk,€7.00m
2936,22 July 2021,"Arsenal are stepping up their pursuit of Barcelona's Brazilian goalkeeper Neto, 31.",Neto,"['Arsenal', 'Barcelona']",23,Portugal,Goalkeeper,40,www.mundodeportivo.com,€2.50m
2938,22 July 2021,"Tottenham are close to agreeing a deal with Sevilla for Spanish winger Bryan Gil, 20, with Argentine forward Erik Lamela, 29, moving to the La Liga club.",Bryan Gil,"['Tottenham', 'Sevilla']",22,Scotland,Left Winger,40,www.skysports.com,€12.00m
2938,22 July 2021,"Tottenham are close to agreeing a deal with Sevilla for Spanish winger Bryan Gil, 20, with Argentine forward Erik Lamela, 29, moving to the La Liga club.",Erik Lamela,"['Tottenham', 'Sevilla']",,,,40,www.skysports.com,
2940,22 July 2021,"Manchester United are open to making two more major signings before the transfer window closes in six weeks' time, with Atletico Madrid and England full-back Kieran Trippier among their top targets.",Kieran Trippier,"['Manchester United', 'Atletico Madrid']",33,England,Right-Back,40,www.manchestereveningnews.co.uk,€13.00m
2941,22 July 2021,"United remain keen on signing Trippier, 30, despite Atletico demanding in excess of £18m.",Trippier,"['United', 'Atletico']",33,England,Right-Back,40,talksport.com,€13.00m
2942,22 July 2021,"Juventus are considering a shock swap deal in which Portugal forward Cristiano Ronaldo, 36, would join PSG in return for their 28-year-old Argentina striker Mauro Icardi.",Cristiano Ronaldo,"['Juventus', 'PSG']",38,Portugal,Centre-Forward,40,www.dailystar.co.uk,€20.00m
2944,22 July 2021,Leeds United are favourites to sign Chelsea's English 18-year-old midfielder Lewis Bate.,Lewis Bate,"['Leeds United', 'Chelsea']",21,England,,40,www.dailymail.co.uk,
2945,22 July 2021,Bayer Leverkusen's 25-year-old English winger Demarai Gray had a medical on Tuesday as he moves closer to signing for Everton.,Demarai Gray,"['Bayer Leverkusen', 'Everton']",27,England,Left Winger,40,www.skysports.com,€20.00m
2946,22 July 2021,"Chelsea are looking at former Fulham goalkeeper Marcus Bettinelli, 29, as potential third-choice cover this coming season.",Marcus Bettinelli,"['Chelsea', 'Fulham']",31,England,Goalkeeper,40,www.telegraph.co.uk,€2.00m
2947,22 July 2021,"Newcastle have revived talks over a £4m move for Southampton and Gabon midfielder Mario Lemina, 27, and hope to reach agreement this week.",Mario Lemina,"['Newcastle', 'Southampton']",30,Gabon,Defensive Midfield,40,www.dailymail.co.uk,€10.00m
2949,22 July 2021,"Manchester City might still have a decision to make over whether academy star Liam Delap should be loaned out this season, with Preston North End understood to be interested in the 18-year-old English striker.",Liam Delap,"['Manchester City', 'Preston North End']",20,England,,40,www.manchestereveningnews.co.uk,
2950,22 July 2021,"Germany Under-21 striker Lukas Nmecha, 22, says he joined Wolfsburg from Manchester City as he did not think his chances of regular football with the Premier League champions were very good.",Lukas Nmecha,"['Manchester City', 'Wolfsburg']",,,,40,www.kicker.de,
2951,22 July 2021,Brentford are set to beat Aston Villa to the signing of 18-year-old English goalkeeper Matthew Cox from AFC Wimbledon.,Matthew Cox,"['Brentford', 'Aston Villa', 'AFC Wimbledon']",20,England,Goalkeeper,40,www.footballinsider247.com,-
2952,23 July 2021,"Harry Kane is set to leave Tottenham and join Manchester City in a £160m deal - a Premier League record - which would earn the 27-year-old England striker £400,000 a week.",Harry Kane,"['Tottenham', 'Manchester City']",30,England,,39,www.thesun.co.uk,
2953,23 July 2021,"City are prepared to offer one of Brazilian forward Gabriel Jesus, 24, Algeria captain Riyad Mahrez, 30, Portugal midfielder Bernardo Silva, 26, or England attacker Raheem Sterling, 26, as part of a deal to tempt Spurs into selling the England captain.",Gabriel Jesus,"['City', 'Spurs']",,,,39,www.fourfourtwo.com,
2953,23 July 2021,"City are prepared to offer one of Brazilian forward Gabriel Jesus, 24, Algeria captain Riyad Mahrez, 30, Portugal midfielder Bernardo Silva, 26, or England attacker Raheem Sterling, 26, as part of a deal to tempt Spurs into selling the England captain.",Riyad Mahrez,"['City', 'Spurs']",32,Algeria,,39,www.fourfourtwo.com,
2953,23 July 2021,"City are prepared to offer one of Brazilian forward Gabriel Jesus, 24, Algeria captain Riyad Mahrez, 30, Portugal midfielder Bernardo Silva, 26, or England attacker Raheem Sterling, 26, as part of a deal to tempt Spurs into selling the England captain.",Bernardo Silva,"['City', 'Spurs']",,,,39,www.fourfourtwo.com,
2953,23 July 2021,"City are prepared to offer one of Brazilian forward Gabriel Jesus, 24, Algeria captain Riyad Mahrez, 30, Portugal midfielder Bernardo Silva, 26, or England attacker Raheem Sterling, 26, as part of a deal to tempt Spurs into selling the England captain.",Raheem Sterling,"['City', 'Spurs']",29,England,Left Winger,39,www.fourfourtwo.com,€60.00m
2954,23 July 2021,Spurs are interested in Atalanta defender Cristian Romero and have reportedly bid £34m plus £8m in add-ons for the 23-year-old Argentine player.,Cristian Romero,"['Spurs', 'Atalanta']",25,Argentina,Centre-Back,39,www.dailymail.co.uk,€60.00m
2955,23 July 2021,"Atalanta are interested in signing Spurs' Colombia defender Davinson Sanchez, 25, as part of a deal for Romero.",Davinson Sanchez,"['Atalanta', 'Spurs']",27,Colombia,,39,twitter.com,
2958,23 July 2021,"Manchester United are also struggling to reach an agreement with Real Madrid to sign France centre-back Raphael Varane, 28. The La Liga club are demanding £50m for the defender with United only willing to pay £40m.",Raphael Varane,"['Real Madrid', 'Manchester United']",30,France,Centre-Back,39,www.mirror.co.uk,€40.00m
2959,23 July 2021,"AC Milan are keen to sign Moroccan midfielder Hakim Ziyech, 28, on loan from Chelsea.",Hakim Ziyech,"['AC Milan', 'Chelsea']",30,Morocco,,39,www.calciomercato.com,
2961,23 July 2021,"Newcastle are confident of securing Southampton and Gabon midfielder Mario Lemina, 27, after holding talks with a number of midfield targets who are out of the club's price range.",Mario Lemina,"['Newcastle', 'Southampton']",30,Gabon,Defensive Midfield,39,www.thenorthernecho.co.uk,€10.00m
2966,23 July 2021,Aston Villa could make an offer for River Plate's 21-year-old Argentina forward Julian Alvarez over the next week.,Julian Alvarez,"['Aston Villa', 'River Plate']",,,,39,www.thesun.co.uk,
2967,23 July 2021,"Tottenham and United States defender Cameron Carter-Vickers, 23, is the subject of interest from Newcastle, who are keen to land a centre-back after Brentford won the race to sign Celtic's Norway international defender Kristoffer Ajer, 23.",Cameron Carter-Vickers,"['Tottenham', 'Newcastle', 'Brentford', 'Celtic']",26,USA,Centre-Back,39,www.90min.com,€11.00m
2969,24 July 2021,"Chelsea are poised to submit a £130m bid for Borussia Dortmund's Norway striker Erling Braut Haaland, 22, after owner Roman Abramovich gave his blessing to proceed with what would be a club-record deal.",Erling Braut Haaland,"['Chelsea', 'Borussia Dortmund']",,,,38,www.footballinsider247.com,
2970,24 July 2021,"Inter Milan are demanding at least £102.5m from Chelsea for Belgium striker Romelu Lukaku, 28, if the Blues are unable to sign Haaland.",Romelu Lukaku,"['Inter Milan', 'Chelsea']",30,Belgium,Centre-Forward,38,metro.co.uk,€40.00m
2971,24 July 2021,"Manchester City have reached an agreement with Jack Grealish and are ready to offer Aston Villa £90m for the England attacking midfielder, 25.",Jack Grealish,"['Manchester City', 'Aston Villa']",28,England,Left Winger,38,www.footballinsider247.com,€70.00m
2972,24 July 2021,Manchester City say reports they have agreed a £160m deal for Tottenham striker Harry Kane are nonsense.,Harry Kane,"['Manchester City', 'Tottenham']",30,England,,38,www.manchestereveningnews.co.uk,
2976,24 July 2021,"Manchester United anticipate a formal approach from Paris St-Germain this summer for France midfielder Paul Pogba, 28.",Paul Pogba,"['Manchester United', 'Paris St-Germain']",30,France,Central Midfield,38,www.telegraph.co.uk,€20.00m
2979,24 July 2021,"Barcelona believe if Portugal forward Cristiano Ronaldo, 36, leaves Juventus this summer, the Italian club would be willing to take their France forward Antoine Griezmann on loan, with an option to buy the 30-year-old.",Cristiano Ronaldo,"['Barcelona', 'Juventus']",38,Portugal,Centre-Forward,38,www.sport.es,€20.00m
2981,24 July 2021,Arsenal will not be offering a new contract to 30-year-old French striker Alexandre Lacazette and are inviting bids of about £15m for their former record signing to help fund a move for 23-year-old Chelsea and England forward Tammy Abraham.,Alexandre Lacazette,"['Arsenal', 'Chelsea']",32,France,Centre-Forward,38,www.thesun.co.uk,€12.00m
2981,24 July 2021,Arsenal will not be offering a new contract to 30-year-old French striker Alexandre Lacazette and are inviting bids of about £15m for their former record signing to help fund a move for 23-year-old Chelsea and England forward Tammy Abraham.,Tammy Abraham,"['Chelsea', 'Arsenal']",26,England,Centre-Forward,38,www.thesun.co.uk,€45.00m
2982,24 July 2021,Newcastle United manager Steve Bruce has reiterated the club's desire to sign England Under-21 midfielder Joe Willock from Arsenal but says the Magpies are waiting for the Gunners and 21-year-old to make a decision about his future.,Joe Willock,"['Newcastle United', 'Arsenal']",20,England,Central Midfield,38,www.skysports.com,€30.00m
2985,24 July 2021,"Fulham are closing in on a £10m move for Liverpool's Wales winger Harry Wilson, 24.",Harry Wilson,"['Fulham', 'Liverpool']",26,Wales,Right Winger,38,www.thesun.co.uk,€13.00m
2986,24 July 2021,Bayer Leverkusen have rejected a £30m offer from Aston Villa for 23-year-old Jamaica winger Leon Bailey.,Leon Bailey,"['Bayer Leverkusen', 'Aston Villa']",26,Jamaica,Left Winger,38,www.footballinsider247.com,€25.00m
2987,24 July 2021,Manchester City's 24-year-old Brazil forward Gabriel Jesus tops Juventus' list of summer targets.,Gabriel Jesus,"['Manchester City', 'Juventus']",,,,38,www.calciomercato.it,
2993,25 July 2021,"Manchester United may look to sell France forward Anthony Martial, 25, with Tottenham interested in the France forward.",Anthony Martial,"['Manchester United', 'Tottenham']",28,France,Centre-Forward,37,www.dailystar.co.uk,€15.00m
2994,25 July 2021,"United boss Ole Gunnar Solskjaer wants France midfielder Paul Pogba, 28, to stay amid interest from Paris St-Germain.",Paul Pogba,"['Manchester United', 'Paris St-Germain']",30,France,Central Midfield,37,www.manchestereveningnews.co.uk,€20.00m
2995,25 July 2021,"Bayern Munich are interested in 25-year-old Chelsea striker Timo Werner, with the Germany international's former manager from RB Leipzig, Julian Nagelsmann, now in charge of the Bundesliga champions.",Timo Werner,"['Bayern Munich', 'Chelsea', 'RB Leipzig']",27,Germany,Centre-Forward,37,www.footballinsider247.com,€25.00m
2999,25 July 2021,"England captain Harry Kane, 27, is to miss start of Premier League season after his exertions at the European Championship. The Tottenham forward favours a move to Manchester City.",Harry Kane,"['Tottenham', 'Manchester City']",30,England,,37,www.telegraph.co.uk,
3000,25 July 2021,"Arsenal hope to confirm the £50m signing of England defender Ben White, 23, from Brighton after his medical this weekend.",Ben White,"['Arsenal', 'Brighton']",26,England,Right-Back,37,www.dailymail.co.uk,€50.00m
3001,25 July 2021,"The Gunners are also looking at the possibility of signing Switzerland midfielder Denis Zakaria, 24, who has expressed a desire to leave Borussia Monchengladbach.",Denis Zakaria,"['Arsenal', 'Borussia Monchengladbach']",27,Switzerland,Defensive Midfield,37,www.mirror.co.uk,€20.00m
