id,date,raw_text,player_name,clubs_mentioned,player_age,player_nationality,player_position,time_to_transfer_window,source,market_value
4365,19 October 2021,Arsenal and Leicester City are both monitoring Southampton and Norway winger Mohamed Elyounoussi after the 27-year-old's impressive start to the season.,Mohamed Elyounoussi,"['Arsenal', 'Leicester City', 'Southampton']",29,Norway,Left Winger,,www.thesun.co.uk,€12.00m
4372,20 October 2021,"Atletico Madrid and England right-back Kieran Trippier, 31, who was heavily linked with a move to Manchester United in the summer, has said he would ""love"" to play in the Premier League again.",Kieran Trippier,"['Atletico Madrid', 'Manchester United']",33,England,Right-Back,,www.mirror.co.uk,€13.00m
4378,20 October 2021,Roma are interested in Aston Villa forward Anwar El Ghazi and the Midlands club will let the 26-year-old Netherlands international leave for £18m.,Anwar El Ghazi,"['Roma', 'Aston Villa']",28,Netherlands,Right Winger,,www.footballinsider247.com,€8.00m
4381,20 October 2021,Aston Villa will need to move quickly to sign River Plate's Julian Alvarez as Serie A side AC Milan are also interested in the 21-year-old Argentina forward.,Julian Alvarez,"['Aston Villa', 'AC Milan', 'River Plate']",,,,,www.calciomercato.com,
4382,20 October 2021,Newcastle United and Leeds United will miss out on Blackburn Rovers' English midfielder Joe Rothwell as the 26-year-old has chosen to sign for Rangers instead.,Joe Rothwell,"['Newcastle United', 'Leeds United', 'Blackburn Rovers', 'Rangers']",28,England,Central Midfield,,www.teamtalk.com,€3.50m
4383,20 October 2021,"West Ham United are keeping tabs on Barcelona goalkeeper Neto, 32, who is free to leave the Nou Camp in a January loan deal as long as the club who sign him agree to buy the Brazilian in the summer.",Neto,"['West Ham United', 'Barcelona']",23,Portugal,Goalkeeper,,www.sport.es,€2.50m
4389,21 October 2021,Newcastle are interested in signing 24-year-old England striker Dominic Calvert-Lewin from Everton.,Dominic Calvert-Lewin,"['Newcastle', 'Everton']",26,England,,,www.telegraph.co.uk,
4390,21 October 2021,"Chelsea are interested in signing Norway striker Erling Braut Haaland, 21, from Borussia Dortmund, says Blues boss Thomas Tuchel.",Erling Braut Haaland,"['Chelsea', 'Borussia Dortmund']",,,,,www.thesun.co.uk,
4393,21 October 2021,"Leicester's Belgian midfielder Youri Tielemans, 24, has turned down the offer of a contract extension, putting Manchester United, Chelsea, Liverpool, Real Madrid, Atletico Madrid and Bayern Munich on alert.",Youri Tielemans,"['Manchester United', 'Chelsea', 'Liverpool', 'Real Madrid', 'Atletico Madrid', 'Bayern Munich']",26,Belgium,,,www.90min.com,
4401,22 October 2021,"Real Madrid are set to miss out on Borussia Dortmund forward Erling Braut Haaland, with Manchester City, Paris St-Germain or Bayern Munich the most likely destinations for the 21-year-old.",Erling Braut Haaland,"['Manchester City', 'Paris St-Germain', 'Bayern Munich']",,,,,as.com,
4403,22 October 2021,Borussia Dortmund are angry that Chelsea boss Thomas Tuchel has openly talked about his club's interest in signing Haaland.,Haaland,"['Borussia Dortmund', 'Chelsea']",,,,,www.mirror.co.uk,
4404,22 October 2021,"Newcastle United are interested in Porto and Colombia winger Luis Diaz, 24, and are preparing an offer to meet his release clause of 80m euros (£67.4m).",Luis Diaz,"['Newcastle United', 'Porto']",26,Colombia,Left Winger,,www.marca.com,€75.00m
4409,22 October 2021,"Manchester United midfielder Donny van de Beek, 24, will not be going back to Ajax but there is a strong chance he will leave Old Trafford.",Donny van de Beek,"['Manchester United', 'Ajax', 'Old Trafford']",26,Netherlands,Central Midfield,,twitter.com,€17.00m
4410,22 October 2021,"United boss Ole Gunnar Solskjaer says the club did not receive a bid from Everton for Netherlands international Van de Beek, despite speculation.",Van de Beek,"['United', 'Everton']",26,Netherlands,Central Midfield,,www.manchestereveningnews.co.uk,€17.00m
4419,23 October 2021,"Manchester United and Netherlands midfielder Donny van de Beek, 24, has asked his agent to secure him a move to Real Madrid.",Donny van de Beek,"['Manchester United', 'Real Madrid']",26,Netherlands,Central Midfield,,www.defensacentral.com,€17.00m
4420,23 October 2021,"Chelsea manager Thomas Tuchel claims he ""fell into a trap"" when he spoke about the Blues discussing a move for Borussia Dortmund and Norway striker Erling Braut Haaland, 21.",Erling Braut Haaland,"['Chelsea', 'Borussia Dortmund']",,,,,www.goal.com,
4421,23 October 2021,Juventus are looking at making a move for 27-year-old Chelsea and Spain keeper Kepa Arrizabalaga next summer.,Kepa Arrizabalaga,"['Juventus', 'Chelsea']",29,Spain,,,www.fichajes.net,
4423,23 October 2021,"Manchester United and Portugal forward Cristiano Ronaldo, 36, was ""spoilt"" and ""broke equality and humility rules"" at his former club Juventus.",Cristiano Ronaldo,"['Manchester United', 'Juventus']",38,Portugal,Centre-Forward,,www.tuttosport.com,€20.00m
4425,23 October 2021,"Former Spain midfielder Xavi, who is boss of Al Sadd in Qatar, says he previously rejected taking over as manager of former club Barcelona as he had ""only been a coach for three months"" but now feels ""ready to coach any team in the world"".",Xavi,"['Al Sadd', 'Barcelona']",20,England,Left-Back,,www.marca.com,€1.00m
4426,23 October 2021,"Leicester and France Under-21 defender Wesley Fofana, 20, is attracting interest from Manchester United and Newcastle.",Wesley Fofana,"['Leicester', 'Manchester United', 'Newcastle']",23,France,Centre-Back,,www.butfootballclub.fr,€65.00m
4433,23 October 2021,Manchester City are prepared to join Barcelona in the race to sign 21-year-old Brazil winger Antony from Ajax.,Antony,"['Manchester City', 'Barcelona']",,,,,www.elnacional.cat,
4435,24 October 2021,Wolves skipper Conor Coady is on Newcastle's wanted list for the January transfer window with the 28-year-old England defender likely to cost in the region of £20m.,Conor Coady,"['Wolverhampton Wanderers', 'Newcastle United']",30,England,Centre-Back,,www.thesun.co.uk,€18.00m
4437,24 October 2021,Manchester United will do all they can to keep French midfielder Paul Pogba at Old Trafford with Real Madrid hoping to seal a free transfer for the 28-year-old at the end of the season.,Paul Pogba,"['Manchester United', 'Real Madrid']",30,France,Central Midfield,,as.com,€20.00m
4438,24 October 2021,"However, Pogba will hope to start for Manchester United against Liverpool on Sunday and prove he is worth a new £350,000-a-week contract with the Old Trafford club.",Pogba,"['Manchester United', 'Liverpool']",30,France,Central Midfield,,www.dailymail.co.uk,€20.00m
4440,24 October 2021,Manager Brendan Rodgers has denied reports that Belgian midfielder Youri Tielemans has rejected a new contract at Leicester City with the 24-year-old attracting the interest of a number of clubs including Liverpool and Manchester United.,Youri Tielemans,"['Liverpool', 'Manchester United']",26,Belgium,,,www.dailymail.co.uk,
4445,24 October 2021,Everton are leading the race to sign Jesse Lingard from Manchester United but the 28-year-old England midfielder is also wanted by West Ham and Newcastle.,Jesse Lingard,"['Everton', 'West Ham', 'Newcastle']",31,England,Attacking Midfield,,www.footballinsider247.com,€12.00m
4448,25 October 2021,"Everton and West Ham are among those keen on signing Inter Milan's Croatian winger Ivan Perisic, 32. However, there is also interest from Bundesliga clubs for the player.",Ivan Perisic,"['Everton', 'West Ham', 'Inter Milan', 'Bundesliga']",,,,,www.fichajes.net,
4451,25 October 2021,"Brazilian full-back Marcelo has told Real Madrid that he will leave the club at the end of the season, with Brazilian club Fluminese a likely destination for the 33-year-old.",Marcelo,"['Real Madrid', 'Fluminese']",20,Brazil,,,www.elnacional.cat,
4453,25 October 2021,"Chelsea have made an enquiry over the availability of Porto winger Luis Diaz but Newcastle, Bayern Munich and Real Madrid have also contacted the 24-year-old's representatives.",Luis Diaz,"['Chelsea', 'Newcastle', 'Bayern Munich', 'Real Madrid']",26,Colombia,Left Winger,,twitter.com,€75.00m
4457,25 October 2021,"Chelsea centre-back Antonio Rudiger is tipped to leave Stamford Bridge next summer with the 28-year-old German linked with Juventus, Manchester City, Tottenham and Paris St-Germain.",Antonio Rudiger,"['Juventus', 'Manchester City', 'Tottenham', 'Paris St-Germain']",,,,,www.wettfreunde.net,
4458,25 October 2021,"Arsenal duo Konstantinos Mavropanos, 23, and Matteo Guendouzi, 22, who are on loan at Stuttgart and Marseille respectively, are expected to make the moves permanent next summer.",Konstantinos Mavropanos,"['Arsenal', 'Stuttgart']",,,,,www.football.london,
4458,25 October 2021,"Arsenal duo Konstantinos Mavropanos, 23, and Matteo Guendouzi, 22, who are on loan at Stuttgart and Marseille respectively, are expected to make the moves permanent next summer.",Matteo Guendouzi,"['Arsenal', 'Marseille']",,,,,www.football.london,
4463,26 October 2021,"No matter who is in charge at Manchester United next season, the club are expected to pursue Inter Milan and Italy midfielder Nicolo Barella, 24, Juventus' 24-year-old Italy forward Federico Chiesa, and Atletico Madrid's England defender Kieran Trippier, 31.",Kieran Trippier,"['Manchester United', 'Atletico Madrid']",33,England,Right-Back,,www.fichajes.net,€13.00m
4465,26 October 2021,"Newcastle United have set their sights on signing Aston Villa and Zimbabwe midfielder Marvelous Nakamba, 27, in January.",Marvelous Nakamba,"['Newcastle United', 'Aston Villa']",29,Zimbabwe,Defensive Midfield,,www.footballinsider247.com,€4.00m
4473,26 October 2021,"Tottenham, Aston Villa and Everton are interested in signing Stoke City and Australia defender Harry Souttar, 23.",Harry Souttar,"['Tottenham', 'Aston Villa', 'Everton']",25,Australia,Centre-Back,,www.footballinsider247.com,€15.00m
4474,27 October 2021,"Manchester United midfielder Paul Pogba, 28, ignored manger Ole Gunnar Solskjaer after being sent off in the 5-0 defeat by Liverpool on Sunday and the Frenchman has stalled negotiations over a new deal with the club.",Paul Pogba,"['Manchester United', 'Liverpool']",30,France,Central Midfield,,www.thesun.co.uk,€20.00m
4481,27 October 2021,"Tottenham and England midfielder Dele Alli, 25, has been left out of the squad to face Burnley in the Carabao Cup, putting his future in fresh doubt.",Dele Alli,"['Tottenham', 'Burnley']",27,England,Attacking Midfield,,www.dailymail.co.uk,€11.00m
4483,27 October 2021,"Arsenal are struggling to convince William Saliba that his future is at Emirates Stadium and could be forced to cash in on the French defender, 20, who is impressing on loan at Marseille.",William Saliba,"['Arsenal', 'Emirates Stadium', 'Marseille']",22,France,Centre-Back,,www.thesun.co.uk,€55.00m
4488,27 October 2021,"Aston Villa, AC Milan and Bayer Leverkusen are among the clubs interested in River Plate's Argentina forward Julian Alvarez, 21.",Julian Alvarez,"['Aston Villa', 'AC Milan', 'Bayer Leverkusen']",,,,,www.calciomercato.com,
4490,28 October 2021,"Liverpool have joined Manchester United in the battle to sign Leeds United and England midfielder Kalvin Phillips, 25, in a £60m deal.",Kalvin Phillips,"['Liverpool', 'Manchester United', 'Leeds United']",28,England,Defensive Midfield,,www.dailystar.co.uk,€35.00m
4492,28 October 2021,"Paris St-Germain have joined the race to sign Leeds winger Raphinha, 24, after receiving glowing references from his Brazil team-mate Neymar.",Raphinha,"['Paris St-Germain', 'Leeds']",,,,,www.teamtalk.com,
4494,28 October 2021,"Barcelona have offered former midfielder Xavi, who is coach of Al Sadd in Qatar, the role of manager after the Nou Camp club sacked Ronald Koeman.",Xavi,"['Barcelona', 'Al Sadd']",20,England,Left-Back,,www.goal.com,€1.00m
4501,28 October 2021,"Chelsea are looking at making moves for Sevilla's French defender Jules Kounde as well as Juventus and Netherlands centre-back Matthijs de Ligt, both 22, as they fear Germany's Antonio Rudiger, 28, and Denmark's Andreas Christensen could leave the club.",Antonio Rudiger,"['Chelsea', 'Germany']",,,,,metro.co.uk,
4501,28 October 2021,"Chelsea are looking at making moves for Sevilla's French defender Jules Kounde as well as Juventus and Netherlands centre-back Matthijs de Ligt, both 22, as they fear Germany's Antonio Rudiger, 28, and Denmark's Andreas Christensen could leave the club.",Andreas Christensen,"['Chelsea', 'Denmark']",,,,,metro.co.uk,
4512,29 October 2021,"Manchester City made an approach to sign Belgium striker Romelu Lukaku from Inter Milan last year prior to the 28-year-old's move to Premier League rivals Chelsea in August, the player's agent says.",Romelu Lukaku,"['Manchester City', 'Chelsea', 'Inter Milan']",30,Belgium,Centre-Forward,,www.telegraph.co.uk,€40.00m
4514,29 October 2021,Arsenal could face competition from Barcelona in their bid to sign Manchester City's England forward Raheem Sterling.,Raheem Sterling,"['Arsenal', 'Barcelona', 'Manchester City']",29,England,Left Winger,,www.football.london,€60.00m
4517,29 October 2021,"Southampton and England midfielder James Ward-Prowse is a target for Newcastle United in the January transfer window, despite the 26-year-old signing a new deal with the Saints in the summer.",James Ward-Prowse,"['Southampton', 'Newcastle United']",34,England,,,www.footballinsider247.com,
4531,30 October 2021,Arsenal's Spanish boss ​​​​​Mikel Arteta - a former Barcelona youth player - has ruled himself out of contention for the vacant Barcelona manager's job.,Mikel Arteta,"['Arsenal', 'Barcelona']",,,,,www.skysports.com,
4532,30 October 2021,Newcastle are interested in signing Manchester United's Jesse Lingard. The 29-year-old England midfielder has been linked with a move to St James' Park in January.,Jesse Lingard,"['Newcastle', 'Manchester United']",31,England,Attacking Midfield,,www.thesun.co.uk,€12.00m
4536,30 October 2021,"Arsenal manager Mikel Arteta says French defender William Saliba, 20, could fight for a place in the Gunners squad when he returns from his loan at Marseille next season.",William Saliba,"['Arsenal', 'Marseille']",22,France,Centre-Back,,www.goal.com,€55.00m
4537,30 October 2021,"Leicester City manager Brendan Rodgers has called Belgium international Youri Tielemans ""one of the best midfielders in Europe"" with Manchester United, Liverpool and Bayern Munich linked with the 24-year-old.",Youri Tielemans,"['Manchester United', 'Liverpool', 'Bayern Munich']",26,Belgium,,,www.mirror.co.uk,
4538,30 October 2021,"Napoli and Senegal defender Kalidou Koulibaly, 30, says he would only leave the club for three teams in the world - Manchester City, Real Madrid or Barcelona.",Kalidou Koulibaly,"['Napoli', 'Manchester City', 'Real Madrid', 'Barcelona']",,,,,sportwitness.co.uk,
4540,30 October 2021,"Crystal Palace boss Patrick Vieira said it was a ""joy"" to work with 21-year-old English midfielder Conor Gallagher, on loan from Chelsea, but said it was too early to discuss a permanent transfer.",Conor Gallagher,"['Crystal Palace', 'Chelsea']",23,England,Central Midfield,,www.independent.co.uk,€32.00m
4550,31 October 2021,"Donny van de Beek's Manchester United team-mates encouraged the Netherlands midfielder, 24, to change agent in a bid to force a move away from Old Trafford. Conversations have taken place with Everton and Wolves over a loan deal.",Donny van de Beek,"['Manchester United', 'Everton', 'Wolves']",26,Netherlands,Central Midfield,,www.dailymail.co.uk,€17.00m
4551,31 October 2021,"Liverpool are keen on Leicester and England winger Harvey Barnes, 23.",Harvey Barnes,"['Liverpool', 'Leicester']",26,England,,,www.fichajes.net,
4553,31 October 2021,"Manchester City's 19-year-old star James McAtee is being closely followed by Manchester United and Liverpool, with the English midfielder yet to sign a new contract at the club.",James McAtee,"['Manchester City', 'Manchester United', 'Liverpool']",21,England,,,www.thesun.co.uk,
4554,31 October 2021,Crystal Palace will cut short striker Jean-Philippe Mateta's loan deal in January. The 24-year-old Frenchman is on loan until the end of the season from Mainz but is not in manager Patrick Vieira's plans.,Jean-Philippe Mateta,"['Crystal Palace', 'Mainz']",26,France,Centre-Forward,,www.thesun.co.uk,€9.00m
4558,1 November 2021,"Barcelona are interested in taking Manchester United and Netherlands midfielder Donny van de Beek, 24, on loan.",Donny van de Beek,"['Barcelona', 'Manchester United']",26,Netherlands,Central Midfield,,www.sport.es,€17.00m
4563,1 November 2021,Paris St-Germain are also monitoring Pogba's situation at Manchester United.,Pogba,"['Paris St-Germain', 'Manchester United']",30,France,Central Midfield,,le10sport.com,€20.00m
4565,1 November 2021,"Manchester United missed out on signing PSG and Senegal midfielder Idrissa Gueye, 32, last summer because they weren't able to make a firm offer with several players staying at the club.",Idrissa Gueye,"['Manchester United', 'PSG']",,,,,www.dailymail.co.uk,
4566,1 November 2021,"Arsenal are still keeping tabs on Real Madrid and Spain midfielder Dani Ceballos, 25, despite not signing him after a two-year loan spell.",Dani Ceballos,"['Arsenal', 'Real Madrid']",,,,,www.teamtalk.com,
4570,1 November 2021,"Everton and Aston Villa are the leading the race to secure the transfer of Tottenham and England midfielder Harry Winks, 25, in January.",Harry Winks,"['Everton', 'Aston Villa', 'Tottenham']",27,England,Defensive Midfield,,www.caughtoffside.com,€12.00m
4577,2 November 2021,Al Sadd have told Barcelona officials they will have to visit Qatar to agree a deal for Xavi to take charge of the club he played for.,Xavi,"['Al Sadd', 'Barcelona']",20,England,Left-Back,,as.com,€1.00m
4578,2 November 2021,"Xavi has already given Barcelona a list of four players he wants to sign, including Manchester United's France midfielder Paul Pogba, 28, who is out of contract at the end of this season.",Xavi,"['Barcelona', 'Manchester United']",20,England,Left-Back,,www.elnacional.cat,€1.00m
4583,2 November 2021,Chelsea will make a decision in January over whether to cut short Scotland midfielder Billy Gilmour's season-long lean spell at Norwich City. The 20-year-old has been struggling for first-team football at the Carrow Road club.,Billy Gilmour,"['Chelsea', 'Norwich City']",22,Scotland,Central Midfield,,www.goal.com,€9.00m
4584,2 November 2021,"Juventus may be forced to sell Wales midfielder Aaron Ramsey, 30, or United States midfielder Weston McKennie, 23, to fund moves for Fiorentina's Serbia striker Dusan Vlahovic, 21, and Borussia Dortmund's Belgium midfielder Axel Witsel, 32.",Aaron Ramsey,"['Juventus', 'Wales', 'Fiorentina']",20,England,,,www.tuttosport.com,
4584,2 November 2021,"Juventus may be forced to sell Wales midfielder Aaron Ramsey, 30, or United States midfielder Weston McKennie, 23, to fund moves for Fiorentina's Serbia striker Dusan Vlahovic, 21, and Borussia Dortmund's Belgium midfielder Axel Witsel, 32.",Weston McKennie,"['United States', 'Juventus', 'Borussia Dortmund']",,,,,www.tuttosport.com,
4586,2 November 2021,"PSG are set to make an offer to sign Portugal defensive midfielder Joao Palhinha, 26, from Sporting Lisbon.",Joao Palhinha,"['PSG', 'Sporting Lisbon']",,,,,www.ojogo.pt,
4591,3 November 2021,"Manchester United's Paul Pogba prefers a return to Juventus over joining Paris St-Germain or Real Madrid when the France midfielder, 28, becomes a free agent next summer.",Paul Pogba,"['Juventus', 'Paris St-Germain', 'Real Madrid']",30,France,Central Midfield,,www.gazzetta.it,€20.00m
4592,3 November 2021,"Erling Braut Haaland has decided to leave Borussia Dortmund and his agent wants the Norway striker, 21, to join Barcelona.",Erling Braut Haaland,"['Borussia Dortmund', 'Barcelona']",,,,,www.elnacional.cat,
4593,3 November 2021,"Borussia Dortmund, though, are confident they will keep Manchester City and Chelsea target Haaland, despite a £64m release clause that is believed to kick in next year.",Haaland,"['Borussia Dortmund', 'Manchester City', 'Chelsea']",,,,,www.manchestereveningnews.co.uk,
4595,3 November 2021,"Newcastle are planning a free transfer swoop for Inter Milan's Marcelo Brozovic as the Croatia defensive midfielder, 28, is out of contract next summer.",Marcelo Brozovic,"['Newcastle', 'Inter Milan']",,,,,www.thesun.co.uk,
4597,3 November 2021,"Tottenham, West Ham and Southampton are all chasing West Brom's England goalkeeper Sam Johnstone, 28, whose contract expires next summer.",Sam Johnstone,"['Tottenham', 'West Ham', 'Southampton']",30,England,Goalkeeper,,www.skysports.com,€4.00m
4600,3 November 2021,"Christian Eriksen is open to rejoining Ajax in January as the Danish midfielder, 29, is unable to play for his current club Inter Milan having been fitted with a heart defibrillator.",Christian Eriksen,"['Ajax', 'Inter Milan']",31,Denmark,Central Midfield,,www.corrieredellosport.it,€25.00m
4602,3 November 2021,"England youth international Fabio Carvalho has turned down a 'massive' offer to stay with Fulham and the 19-year-old winger, who has been linked with Real Madrid, is now set to be out of contract at the end of the season.",Fabio Carvalho,"['Fulham', 'Real Madrid']",,,,,www.thesun.co.uk,
4607,4 November 2021,"Manchester United's Paul Pogba prefers a return to Juventus over joining Paris St-Germain or Real Madrid when the France midfielder, 28, becomes a free agent next summer.",Paul Pogba,"['Manchester United', 'Juventus', 'Paris St-Germain', 'Real Madrid']",30,France,Central Midfield,,www.gazzetta.it,€20.00m
4608,4 November 2021,"Erling Braut Haaland has decided to leave Borussia Dortmund and his agent wants the Norway striker, 21, to join Barcelona.",Erling Braut Haaland,"['Borussia Dortmund', 'Barcelona']",,,,,www.elnacional.cat,
4609,4 November 2021,"Borussia Dortmund, though, are confident they will keep Manchester City and Chelsea target Haaland, despite a £64m release clause that is believed to kick in next year.",Haaland,"['Borussia Dortmund', 'Manchester City', 'Chelsea']",,,,,www.manchestereveningnews.co.uk,
4611,4 November 2021,"Newcastle are planning a free transfer swoop for Inter Milan's Marcelo Brozovic as the Croatia defensive midfielder, 28, is out of contract next summer.",Marcelo Brozovic,"['Newcastle', 'Inter Milan']",,,,,www.thesun.co.uk,
4613,4 November 2021,"Tottenham, West Ham and Southampton are all chasing West Brom's England goalkeeper Sam Johnstone, 28, whose contract expires next summer.",Sam Johnstone,"['Tottenham', 'West Ham', 'Southampton']",30,England,Goalkeeper,,www.skysports.com,€4.00m
4616,4 November 2021,"Christian Eriksen is open to rejoining Ajax in January as the Danish midfielder, 29, is unable to play for his current club Inter Milan having been fitted with a heart defibrillator.",Christian Eriksen,"['Ajax', 'Inter Milan']",31,Denmark,Central Midfield,,www.corrieredellosport.it,€25.00m
4618,4 November 2021,"England youth international Fabio Carvalho has turned down a 'massive' offer to stay with Fulham and the 19-year-old winger, who has been linked with Real Madrid, is now set to be out of contract at the end of the season.",Fabio Carvalho,"['Fulham', 'Real Madrid']",,,,,www.thesun.co.uk,
4620,5 November 2021,"Roma boss Jose Mourinho has identified English midfielders Ruben Loftus-Cheek of Chelsea and Tottenham's Harry Winks, who are both 25, as transfer targets.",Ruben Loftus-Cheek,"['Chelsea', 'Tottenham']",27,England,,,www.corrieredellosport.it,
4621,5 November 2021,"Sweden striker Alexander Isak, 22, says he is ""very happy"" at Spanish club Real Sociedad but ""one day it would be nice to play in England"".",Alexander Isak,"['Real Sociedad', 'England']",,,,,www.independent.co.uk,
4624,5 November 2021,Juventus and USA midfielder Weston McKennie's future in Turin is in doubt amid reported interest in the 23-year-old from Tottenham. (to - in Italianexternal-link),Weston McKennie,"['Juventus', 'Tottenham']",,,,,www.calciomercato.com,
4626,5 November 2021,"Newcastle United are keen to take 22-year-old French midfielder Matteo Guendouzi away from Marseille, where he is currently on loan from Arsenal.",Matteo Guendouzi,"['Newcastle United', 'Arsenal', 'Marseille']",,,,,www.mirror.co.uk,
4629,5 November 2021,"Liverpool are confident of beating a number of clubs to the signing of England youth international Fabio Carvalho, with the 19-year-old winger's contract at Fulham running out next summer.",Fabio Carvalho,"['Liverpool', 'Fulham']",,,,,www.teamtalk.com,
4630,5 November 2021,"Japan defender Takehiro Tomiyasu, 22, says he nearly joined Tottenham before signing for their north London rivals Arsenal in the summer.",Takehiro Tomiyasu,"['Tottenham', 'Arsenal']",25,Japan,Right-Back,,www.goal.com,€25.00m
4631,5 November 2021,"Atletico Madrid plan to offer a deal to 28-year-old Croatia midfielder Marcelo Brozovic, who will be out of contract at Inter Milan next summer and has been linked with Manchester United and Newcastle.",Marcelo Brozovic,"['Atletico Madrid', 'Manchester United', 'Newcastle']",,,,,www.fichajes.net,
4632,5 November 2021,"Barnsley, Derby County, Millwall and Luton Town are among the clubs interested in signing 20-year-old English winger Jack Clarke from Tottenham in January.",Jack Clarke,"['Barnsley', 'Derby County', 'Millwall', 'Luton Town']",23,England,Left Winger,,www.teamtalk.com,€8.00m
