id,date,raw_text,player_name,clubs_mentioned,player_age,player_nationality,player_position,time_to_transfer_window,source,market_value
1616,12 May 2021,"Manchester United are ready to make a £15m bid for FC Nordsjaelland and Ghana winger Kamaldeen Sulemana, 19. However, there are concerns he wouldn't be granted a work permit to play in the UK.",Kamaldeen Sulemana,"['Manchester United', 'FC Nordsjaelland', 'Ghana']",21,Ghana,Left Winger,28,www.thesun.co.uk,€22.00m
1620,13 May 2021,"Tottenham Hotspur and England striker Harry Kane, 27, will be stuck at the London club unless Pep Guardiola demands Manchester City sign him over Borussia Dortmund's Erling Braut Haaland, 20.",Harry Kane,"['Tottenham Hotspur', 'Manchester City', 'Borussia Dortmund']",30,England,,27,www.thesun.co.uk,
1623,13 May 2021,"Dortmund and England winger Jadon Sancho, 21, is pushing his agent to secure a move to Manchester United after one failed to materialise last summer.",Jadon Sancho,"['Dortmund', 'Manchester United']",23,England,Left Winger,27,www.manchestereveningnews.co.uk,€55.00m
1624,13 May 2021,"Manchester United are interested in Atalanta's Argentine centre-back Cristian Romero, 23, who joins Lille's 21-year-old Dutch defender Sven Botman and Sevilla's French 22-year-old Jules Kounde on the Premier League club's shortlist.",Cristian Romero,"['Manchester United', 'Atalanta']",25,Argentina,Centre-Back,27,www.skysports.com,€60.00m
1624,13 May 2021,"Manchester United are interested in Atalanta's Argentine centre-back Cristian Romero, 23, who joins Lille's 21-year-old Dutch defender Sven Botman and Sevilla's French 22-year-old Jules Kounde on the Premier League club's shortlist.",Sven Botman,"['Lille', 'Manchester United']",,,,27,www.skysports.com,
1627,13 May 2021,"Slavia Prague's 19-year-old Senegalese forward Abdallah Sima, who is a target for Arsenal and West Ham, is keen on a move to the Premier League.",Abdallah Sima,"['Arsenal', 'West Ham']",,,,27,www.standard.co.uk,
1630,13 May 2021,"Match of the Day pundit Ian Wright believes Brighton's Mali midfielder Yves Bissouma, 24, should reject Liverpool and join Manchester United this summer.",Yves Bissouma,"['Brighton', 'Liverpool', 'Manchester United']",27,Mali,Central Midfield,27,metro.co.uk,€25.00m
1633,13 May 2021,"Manchester City and Germany striker Lukas Nmecha, 22, is attracting interest from Premier League and Bundesliga teams according to his father, after an impressive season for Anderlecht, where he has scored 18 goals in 37 games.",Lukas Nmecha,"['Manchester City', 'Anderlecht']",,,,27,tbrfootball.com,
1640,14 May 2021,Leicester City are interested in signing Southampton's English left-back Ryan Bertrand. The 31-year-old's contract expires at the end of the season after seven years with the Saints.,Ryan Bertrand,"['Leicester City', 'Southampton']",34,England,Left-Back,26,www.leicestermercury.co.uk,€1.00m
1644,14 May 2021,"Could Benjamin Mendy, 26, be on his way to Chelsea? Manchester City's France left-back's name has appeared on the list of options on Chelsea's online shop for fans wanting a player's name on the back of their shirts.",Benjamin Mendy,"['Chelsea', 'Manchester City']",28,France,,26,www.manchestereveningnews.co.uk,
1646,14 May 2021,"Tottenham are reportedly hoping to convince 24-year-old Denmark centre-back Joachim Andersen, who has spent this season on loan at Fulham from French side Lyon, to join them over north London rivals Arsenal.",Joachim Andersen,"['Tottenham', 'Arsenal', 'Fulham', 'Lyon']",27,Denmark,Centre-Back,26,www.teamtalk.com,€32.00m
1647,14 May 2021,"Former Barcelona midfielder Xavi has signed a new contract to continue managing Qatari-based club Al-Sadd until 2023, dealing a blow to Barca president Joan Laporta, who is looking to replace current boss Ronald Koeman with the Spaniard for next season.",Xavi,"['Al-Sadd', 'Barcelona']",20,England,Left-Back,26,www.dailymail.co.uk,€1.00m
1648,14 May 2021,"Leeds United are ahead of AC Milan in the race to sign 26-year-old Udinese midfielder Rodrigo De Paul, but Liverpool are also said to be interested in the Argentina international.",Rodrigo De Paul,"['Leeds United', 'AC Milan', 'Liverpool']",,,,26,www.ilmilanista.it,
1650,14 May 2021,"Wolves' Portugal goalkeeper Rui Patricio, 33, who has just over 12 months left on his contract at Molineux, could be a target for new Roma manger Jose Mourinho.",Rui Patricio,"['Wolverhampton Wanderers', 'Roma']",,,,26,www.calciomercato.com,
1651,14 May 2021,"Cristiano Ronaldo's mum, Dolores Aveiro, would like her famous son to return to Sporting Lisbon, should the 36-year-old forward leave Juventus in the summer.",Cristiano Ronaldo,"['Sporting Lisbon', 'Juventus']",38,Portugal,Centre-Forward,26,www.theguardian.com,€20.00m
1653,15 May 2021,"Sources close to Borussia Dortmund forward Jadon Sancho, 21, are more confident than ever before that the England international will complete a move to Manchester United this summer. The Premier League club are expected to make an initial offer of £65-75m.",Jadon Sancho,"['Borussia Dortmund', 'Manchester United']",23,England,Left Winger,25,www.eurosport.co.uk,€55.00m
1654,15 May 2021,"Manchester United could use England forward Jesse Lingard, 28, in a deal for Sancho.",Jesse Lingard,"['Manchester United', 'England']",31,England,Attacking Midfield,25,www.thesun.co.uk,€12.00m
1656,15 May 2021,Manchester United are holding talks with Real Madrid's 28-year-old France defender Raphael Varane.,Raphael Varane,"['Manchester United', 'Real Madrid']",30,France,Centre-Back,25,www.manchestereveningnews.co.uk,€40.00m
1658,15 May 2021,"RB Leipzig's chief Oliver Mintzlaff has confirmed 21-year-old French defender Ibrahima Konate, who is among Liverpool's transfer targets, has a release clause. The figure is believed to be £34m.",Ibrahima Konate,"['RB Leipzig', 'Liverpool']",,,,25,www.liverpoolecho.co.uk,
1660,15 May 2021,"Chelsea manager Thomas Tuchel has been given a choice of signing Borussia Dortmund's Norway striker Erling Braut Haaland, 20, or Inter Milan's Belgium forward Romelu Lukaku, 28.",Erling Braut Haaland,"['Chelsea', 'Borussia Dortmund']",,,,25,www.express.co.uk,
1660,15 May 2021,"Chelsea manager Thomas Tuchel has been given a choice of signing Borussia Dortmund's Norway striker Erling Braut Haaland, 20, or Inter Milan's Belgium forward Romelu Lukaku, 28.",Romelu Lukaku,"['Chelsea', 'Inter Milan']",30,Belgium,Centre-Forward,25,www.express.co.uk,€40.00m
1664,15 May 2021,"Southampton are planning a £20m summer bid for Chelsea's 25-year-old England midfielder Ruben Loftus-Cheek, who is currently on loan at Fulham.",Ruben Loftus-Cheek,"['Southampton', 'Chelsea', 'Fulham']",27,England,,25,www.express.co.uk,
1665,15 May 2021,"Leicester are close to completing the signing of French midfielder Boubakary Soumare, 22, from Lille for around £20m.",Boubakary Soumare,"['Leicester', 'Lille']",24,France,Defensive Midfield,25,twitter.com,€20.00m
1667,15 May 2021,"Arsenal are not planning on extending the loan of Real Madrid's Spanish midfielder Dani Ceballos, 24.",Dani Ceballos,"['Arsenal', 'Real Madrid']",,,,25,www.independent.co.uk,
1668,15 May 2021,"Arsenal will be in the market for players in at least five positions in the summer transfer window. Among their targets, Brighton's Mali midfielder Yves Bissouma, 24, and Sheffield United's Norwegian midfielder Sander Berge, 23, are keen on a move.",Yves Bissouma,"['Arsenal', 'Brighton']",27,Mali,Central Midfield,25,www.football.london,€25.00m
1669,15 May 2021,"Tottenham's hopes of signing Lyon's Danish defender Joachim Andersen, who has spent the season on loan at Fulham, have received a boost as the 24-year-old wants to remain in the Premier League.",Joachim Andersen,"['Tottenham', 'Lyon', 'Fulham']",27,Denmark,Centre-Back,25,www.standard.co.uk,€32.00m
1672,15 May 2021,"Manchester City's Argentine striker Sergio Aguero, 32, is close to joining Barcelona on a free contract in the summer - however he will have to take a significant pay cut.",Sergio Aguero,"['Manchester City', 'Barcelona']",,,,25,www.thesun.co.uk,
1673,15 May 2021,"English goalkeeper Tom Heaton, 35, has rejected a new contract at Aston Villa and has verbally agreed to join Manchester United.",Tom Heaton,"['Aston Villa', 'Manchester United']",37,England,Goalkeeper,25,www.footballinsider247.com,€600k
1678,16 May 2021,"Everton are prepared to sell English defender Mason Holgate, 24, to help raise funds in order to try to sign Senegal centre-back Kalidou Koulibaly, 29, from Napoli.",Mason Holgate,"['Everton', 'Napoli']",27,England,,24,www.footballinsider247.com,
1681,16 May 2021,Liverpool will not sign Turkey centre-back Ozan Kabak on a permanent deal this summer. The 21-year-old joined on loan from Schalke in February.,Ozan Kabak,"['Liverpool', 'Schalke']",23,Türkiye,Centre-Back,24,www.thesun.co.uk,€10.00m
1682,16 May 2021,"Arsenal are hoping to beat Manchester City to the signing of 31-year-old England left-back Ryan Bertrand, who will leave Southampton when his contract runs out at the end of the season.",Ryan Bertrand,"['Arsenal', 'Manchester City', 'Southampton']",34,England,Left-Back,24,www.dailymail.co.uk,€1.00m
1683,16 May 2021,Newcastle are monitoring 22-year-old Leeds and Wales forward Tyler Roberts.,Tyler Roberts,"['Newcastle', 'Leeds']",28,Wales,Centre-Forward,24,www.footballinsider247.com,€4.00m
1684,16 May 2021,"West Ham are favourites to sign West Brom's 28-year-old English keeper Sam Johnstone, who has also been linked with Tottenham.",Sam Johnstone,"['West Ham', 'West Brom', 'Tottenham']",30,England,Goalkeeper,24,www.footballinsider247.com,€4.00m
1687,16 May 2021,Villarreal are in pole position to sign Barcelona and Brazil full-back Emerson. The 22-year-old is on loan at Real Betis.,Emerson,"['Villarreal', 'Barcelona', 'Real Betis']",24,Brazil,Left-Back,24,www.mundodeportivo.com,€12.00m
1691,17 May 2021,"Belgium midfielder Youri Tielemans will hold contract talks with Leicester City at the end of the season. The 24-year-old, who scored the winner for the Foxes in the FA Cup final against Chelsea, has two years left on his current deal.",Youri Tielemans,"['Leicester City', 'Chelsea']",26,Belgium,,23,www.dailymail.co.uk,
1694,17 May 2021,Barcelona have opened talks with former midfielder and Qatari side Al Sadd's manager Xavi about replacing Ronald Koeman as the Nou Camp club's boss.,Xavi,"['Barcelona', 'Al Sadd']",20,England,Left-Back,23,www.footballtransfers.com,€1.00m
1696,17 May 2021,"Wolves and Portugal goalkeeper Rui Patricio, 33, is a possible target for Roma, but Jose Mourinho's new club are not interested in departing Juventus keeper Gianluigi Buffon, 43.",Rui Patricio,"['Wolves', 'Roma']",,,,23,www.calciomercato.com,
1699,17 May 2021,Tottenham defender Toby Alderweireld is a target for Club Bruges but the 32-year-old Belgium international will not make a decision on his future until finding out who will take over from interim Spurs boss Ryan Mason.,Toby Alderweireld,"['Club Bruges', 'Spurs']",,,,23,www.express.co.uk,
1700,17 May 2021,"Leeds United and Burnley have joined Southampton, Watford and Rangers in wanting to sign Newcastle United winger Jacob Murphy, 26.",Jacob Murphy,"['Leeds United', 'Burnley', 'Southampton', 'Watford', 'Rangers', 'Newcastle United']",28,England,,23,www.footballinsider247.com,
1704,18 May 2021,"England striker Harry Kane has once again told Tottenham he wants to leave the Premier League club at the end of the season. Manchester City, Chelsea and Manchester United have expressed a desire to sign the 27-year-old.",Harry Kane,"['Tottenham', 'Manchester City', 'Chelsea', 'Manchester United']",30,England,,22,www.skysports.com,
1705,18 May 2021,"Spanish giants Barcelona have also enquired about Kane, though the Three Lions captain would prefer to stay in England.",Kane,"['Barcelona', 'Three Lions']",30,England,,22,www.thetimes.co.uk,
1708,18 May 2021,"England international Kieran Trippier is being linked with a return to the Premier League, with Manchester United and Everton both set to battle it out for the 30-year-old Atletico Madrid right-back's signature.",Kieran Trippier,"['Manchester United', 'Everton']",33,England,Right-Back,22,theathletic.com,€13.00m
1709,18 May 2021,Brighton & Hove Albion have told Liverpool and Arsenal it will take at least £40m to sign 24-year-old Mali midfielder Yves Bissouma.,Yves Bissouma,"['Brighton & Hove Albion', 'Liverpool', 'Arsenal']",27,Mali,Central Midfield,22,www.thesun.co.uk,€25.00m
1710,18 May 2021,Liverpool are unlikely to turn Ozan Kabak's loan from Schalke into a permanent deal this summer with RB Leipzig considering a move for the 21-year-old Turkey defender.,Ozan Kabak,"['Liverpool', 'Schalke', 'RB Leipzig']",23,Türkiye,Centre-Back,22,www.dailymail.co.uk,€10.00m
1711,18 May 2021,Manchester United lead Ajax in the race to Ghana forward Kamaldeen Sulemana from FC Nordsjaelland after positive talks about signing the 19-year-old on Monday.,Kamaldeen Sulemana,"['Manchester United', 'Ajax', 'FC Nordsjaelland']",21,Ghana,Left Winger,22,www.footballinsider247.com,€22.00m
1714,18 May 2021,"Marseille are close to completing a permanent deal for Arsenal's 22-year-old French midfielder Matteo Guendouzi, who is currently on loan at Hertha Berlin.",Matteo Guendouzi,"['Arsenal', 'Marseille', 'Hertha Berlin']",,,,22,le10sport.com,
1716,18 May 2021,"West Ham have held talks with Slavia Prague over a deal to sign 19-year-old Senegal forward Abdallah Sima, who is also of interest to Crystal Palace.",Abdallah Sima,"['West Ham', 'Crystal Palace', 'Slavia Prague']",,,,22,www.dailymail.co.uk,
1721,19 May 2021,"England striker Harry Kane is eyeing a move worth more than £100m to Manchester City in the summer after telling Tottenham Hotspur he wants to leave. Manchester United are keeping tabs on the 27-year-old, while Spurs would be reluctant to sell him to London rivals Chelsea.",Harry Kane,"['Manchester City', 'Manchester United', 'Chelsea', 'Tottenham Hotspur']",30,England,,21,www.mirror.co.uk,
1723,19 May 2021,"Tottenham started planning for Kane's exit in February and explored the possibility of signing in-demand Norway striker Erling Braut Haaland, 20, from Borussia Dortmund.",Harry Kane,"['Tottenham', 'Borussia Dortmund']",30,England,,21,www.dailymail.co.uk,
1731,19 May 2021,Arsenal's 32-year-old Brazil winger Willian wants to leave for David Beckham's Inter Miami in the United States.,Willian,"['Arsenal', 'Inter Miami']",35,Brazil,Left Winger,21,www.thesun.co.uk,€3.00m
1737,19 May 2021,"Leeds United have been linked with Hertha Berlin's 21-year-old Brazilian forward Matheus Cunha, who has also attracted interest from Napoli, Atalanta and Monaco.",Matheus Cunha,"['Leeds United', 'Hertha Berlin', 'Napoli', 'Atalanta', 'Monaco']",,,,21,www.leeds-live.co.uk,
1739,19 May 2021,The Saints could also make a move for Lazio's 26-year-old Albania goalkeeper Thomas Strakosha.,Thomas Strakosha,"['The Saints', 'Lazio']",,,,21,www.tuttomercatoweb.com,
1744,19 May 2021,Defender Diogo Dalot wants to end his time with Manchester United and join AC Milan on a permanent deal when his loan contract at the San Siro expires in the summer.,Diogo Dalot,"['Manchester United', 'AC Milan']",24,Portugal,Right-Back,21,www.thesun.co.uk,€35.00m
1748,20 May 2021,"Manchester United could make a move for Southampton and England striker Danny Ings, 28, in the summer to strengthen Ole Gunnar Solskjaer's attack.",Danny Ings,"['Manchester United', 'Southampton']",31,England,Centre-Forward,20,www.telegraph.co.uk,€16.00m
1750,20 May 2021,Manchester City are interested in signing Kane and plan to hold talks about signing him from Tottenham.,Kane,"['Manchester City', 'Tottenham']",30,England,,20,www.theguardian.com,
1751,20 May 2021,"However, Manchester United are willing to offer France forward Anthony Martial, 25, plus 28-year-old England striker Jesse Lingard - who is on loan at West Ham - in part-exchange to bring Kane to Old Trafford.",Anthony Martial,"['Manchester United', 'Old Trafford']",28,France,Centre-Forward,20,www.footballinsider247.com,€15.00m
1752,20 May 2021,"Chelsea have launched an £80m bid for Borussia Dortmund's England winger Jadon Sancho, but the London club face a battle with Manchester United for the 21-year-old's signature.",Jadon Sancho,"['Chelsea', 'Manchester United', 'Borussia Dortmund']",23,England,Left Winger,20,www.thesun.co.uk,€55.00m
1754,20 May 2021,"A number of clubs across Europe, including Tottenham, Chelsea, Borussia Dortmund and AC Milan, are set to battle it out to sign England goalkeeper Dean Henderson, 24, from Manchester United.",Dean Henderson,"['Tottenham', 'Chelsea', 'Borussia Dortmund', 'AC Milan']",26,England,Goalkeeper,20,www.skysports.com,€22.00m
1755,20 May 2021,"Wales and Juventus midfielder Aaron Ramsey, 30, has caught the interest of Liverpool. The Reds are said to be considering making an offer for the former Arsenal player in the summer transfer window.",Aaron Ramsey,"['Liverpool', 'Arsenal']",20,England,,20,www.tuttojuve.com,
1758,20 May 2021,Liverpool midfielder Georginio Wijnaldum's contract with the Reds runs out this summer but the 30-year-old Dutch international's hopes of joining Barcelona on a free transfer could collapse if Koeman is sacked.,Georginio Wijnaldum,"['Liverpool', 'Barcelona']",,,,20,www.footballinsider247.com,
1762,20 May 2021,"Everton and Arsenal are keeping tabs on Real Betis defender Emerson Royal. The Brazil international, 22, is on loan from Barcelona but could be interested in a move to the Premier League if his options are limited at the Nou Camp.",Emerson Royal,"['Everton', 'Arsenal', 'Real Betis', 'Barcelona']",,,,20,www.sport.es,
1764,20 May 2021,"Newcastle United's French winger Allan Saint-Maximin says the club should sign Arsenal loanee and England Under-21 midfielder Joe Willock, 21, on a permanent basis.",Allan Saint-Maximin,"['Newcastle United', 'Arsenal']",26,France,Defensive Midfield,20,www.skysports.com,€8.00m
1765,20 May 2021,"With a new goalkeeper reportedly on the list of transfer targets for Southampton, the Saints are said to be monitoring Lazio and Albania goalkeeper Thomas Strakosha, 26, as a potential signing.",Thomas Strakosha,"['Southampton', 'Lazio']",,,,20,sportwitness.co.uk,
1767,21 May 2021,"Manchester City are ready to outbid Manchester United and Chelsea for 27-year-old England striker Harry Kane, who says Tottenham cannot stop him leaving.",Harry Kane,"['Manchester City', 'Manchester United', 'Chelsea', 'Tottenham']",30,England,,19,www.dailystar.co.uk,
1769,21 May 2021,"Real Madrid's Wales forward Gareth Bale, 31, could extend his loan stay with Tottenham by a further year if Kane leaves Spurs.",Gareth Bale,"['Real Madrid', 'Tottenham']",,,,19,en.as.com,
1773,21 May 2021,Tottenham will sell Denmark midfielder Pierre-Emile Hojbjerg if they are offered double the £15m they paid Southampton for the 25-year-old last summer.,Pierre-Emile Hojbjerg,"['Tottenham', 'Southampton']",28,Denmark,,19,www.footballinsider247.com,
1774,21 May 2021,"West Ham and Fulham lead the race to sign Blackburn Rovers' 24-year-old English striker Adam Armstrong, who has been valued at £25m, but they face competition from Brighton and Everton.",Adam Armstrong,"['West Ham', 'Fulham', 'Blackburn Rovers', 'Brighton', 'Everton']",31,Scotland,Centre-Forward,19,www.thesun.co.uk,€12.00m
1777,21 May 2021,Manchester United have made it clear to FC Nordsjaelland that they are prepared to outbid Ajax to sign 19-year-old Ghana striker Kamaldeen Sulemana.,Kamaldeen Sulemana,"['Manchester United', 'FC Nordsjaelland', 'Ajax']",21,Ghana,Left Winger,19,www.footballinsider247.com,€22.00m
1778,21 May 2021,"Wolves' Spain winger Adama Traore, 25, is in talks over a new contract, putting an end to speculation linking him with Liverpool and Barcelona.",Adama Traore,"['Wolverhampton Wanderers', 'Liverpool', 'Barcelona']",,,,19,www.goal.com,
1779,21 May 2021,"Sergio Aguero's free transfer from Manchester City to Barcelona is 80% complete, with the 32-year-old Argentina striker set to have a medical with the Spanish club soon after City feature in the Champions League final on 29 May.",Sergio Aguero,"['Manchester City', 'Barcelona']",,,,19,www.mundodeportivo.com,
1787,21 May 2021,"Wolves' link with agent Jorge Mendes will be helpful as they try to sign Portugal forward Goncalo Guedes, 24, from Valencia, who have ""sent a message to the market"" that they will listen to offers. Sevilla have also shown an interest.",Goncalo Guedes,"['Wolverhampton Wanderers', 'Valencia', 'Sevilla']",,,,19,plazadeportiva.valenciaplaza.com,
1788,21 May 2021,"Manchester United are poised to re-sign 35-year-old English goalkeeper Tom Heaton on a free transfer from Aston Villa. English keeper Sam Johnstone, 28, who was another of United's targets, will move to West Ham from West Brom.",Tom Heaton,"['Manchester United', 'Aston Villa']",37,England,Goalkeeper,19,talksport.com,€600k
1788,21 May 2021,"Manchester United are poised to re-sign 35-year-old English goalkeeper Tom Heaton on a free transfer from Aston Villa. English keeper Sam Johnstone, 28, who was another of United's targets, will move to West Ham from West Brom.",Sam Johnstone,"['West Ham', 'West Brom']",30,England,Goalkeeper,19,talksport.com,€4.00m
1790,21 May 2021,"AC Milan could sign Chelsea's 34-year-old France forward Olivier Giroud, who is out of contract at the end of the season and has been followed by Roma and been linked with Lazio and Inter Milan.",Olivier Giroud,"['AC Milan', 'Chelsea', 'Roma', 'Lazio', 'Inter Milan']",,,,19,www.gazzetta.it,
1791,21 May 2021,"Watford are set to sign 25-year-old Middlesbrough striker Ashley Fletcher on a free transfer, having agreed a five-year contract.",Ashley Fletcher,"['Watford', 'Middlesbrough']",28,England,Centre-Forward,19,www.footballinsider247.com,€800k
1794,23 May 2021,"Chelsea have revived their interest in West Ham's Declan Rice and could use striker Tammy Abraham, 26, in part exchange for the 22-year-old England midfielder. Both Manchester United and Manchester City also remain interested in Rice.",Declan Rice,"['Chelsea', 'West Ham', 'Manchester United', 'Manchester City']",24,England,,17,www.telegraph.co.uk,
1795,23 May 2021,"Manchester City had a bid for Tottenham and England striker Harry Kane, 27, rejected by Spurs chairman Daniel Levy during the January transfer window.",Harry Kane,"['Manchester City', 'Tottenham']",30,England,,17,www.mirror.co.uk,
1796,23 May 2021,Manchester United are ready to table a huge offer to bring Kane to Old Trafford. United's offer would compensate Kane for any lost earnings at Spurs.,Kane,"['Manchester United', 'Spurs']",30,England,,17,www.thetimes.co.uk,
1802,23 May 2021,"Crystal Palace's 28-year-old Ivory Coast forward Wilfried Zaha says if a ""top"" club wanted to sign him he ""wouldn't turn it down"". He has been linked with clubs including Arsenal and Everton.",Wilfried Zaha,"['Arsenal', 'Everton']",31,Côte d'Ivoire,,17,theface.com,
1803,23 May 2021,Middlesbrough's 25-year-old English forward Ashley Fletcher has agreed to join Premier League-bound Watford on a five-year deal when he becomes a free agent in June.,Ashley Fletcher,"['Middlesbrough', 'Watford']",28,England,Centre-Forward,17,www.thesun.co.uk,€800k
1805,23 May 2021,"Leicester City are the latest club to join the race for Southampton's England defender Ryan Bertrand, with Arsenal and AC Milan also linked with the 31-year-old left-back, who is out of contract in the summer.",Ryan Bertrand,"['Leicester City', 'Arsenal', 'AC Milan', 'Southampton']",34,England,Left-Back,17,talksport.com,€1.00m
1811,23 May 2021,"Newcastle United will try again to sign Leicester City midfielder Hamza Choudhury, 23, having missed out on the former England Under-21 player in January.",Hamza Choudhury,"['Newcastle United', 'Leicester City']",26,England,Defensive Midfield,17,www.dailymail.co.uk,€5.00m
1812,23 May 2021,"Incoming Roma boss Jose Mourinho is interested in signing 28-year-old Netherlands striker Wout Weghorst from Wolfsburg as a replacement for Bosnia forward Edin Dzeko, 35.",Wout Weghorst,"['Wolfsburg', 'Roma']",31,Netherlands,Centre-Forward,17,www.gazzetta.it,€14.00m
1815,24 May 2021,"Manchester United are monitoring former forward Cristiano Ronaldo's situation at Juventus, as ""agents connected"" with the Portugal striker, 36 , say he ""could genuinely leave"" the Turin club.",Cristiano Ronaldo,"['Manchester United', 'Juventus']",38,Portugal,Centre-Forward,16,theathletic.com,€20.00m
1818,24 May 2021,Liverpool's hopes of signing 24-year-old Mali midfielder Yves Bissouma from Brighton have been boosted by Arsenal's decision to explore other options.,Yves Bissouma,"['Liverpool', 'Arsenal', 'Brighton']",27,Mali,Central Midfield,16,www.dailymail.co.uk,€25.00m
1819,24 May 2021,"Meanwhile, Liverpool's interest in RB Leipzig's French defender Ibrahima Konate, 21, has been complicated by the Bundesliga club's desire to have his £34m release clause paid in full - so the Reds may turn to 21-year-old Turkey centre-back Ozan Kabak, who has been at Anfield on loan from Schalke since February.",Ibrahima Konate,"['RB Leipzig', 'Liverpool']",,,,16,www.thetimes.co.uk,
1819,24 May 2021,"Meanwhile, Liverpool's interest in RB Leipzig's French defender Ibrahima Konate, 21, has been complicated by the Bundesliga club's desire to have his £34m release clause paid in full - so the Reds may turn to 21-year-old Turkey centre-back Ozan Kabak, who has been at Anfield on loan from Schalke since February.",Ozan Kabak,"['Liverpool', 'Schalke']",23,Türkiye,Centre-Back,16,www.thetimes.co.uk,€10.00m
